{
  "candidate_plans": [
    {
      "abstract_input_shape": {
        "forbidden_byte_classes": [
          "observed_fixed_test_byte_or_class"
        ],
        "max_len": 32,
        "notes": "abstract only; no concrete input generated",
        "required_prefix": null
      },
      "candidate_id": "cand_001",
      "constraints_considered": [
        "sanitizer_candidate_constraints",
        "input_modeling_constraints"
      ],
      "intent": "reach_sink_under_observed_constraints",
      "requires_symbolic_verification": true,
      "target_source": "ip"
    }
  ],
  "decision": "candidate_plan_available",
  "planner_version": "0.1",
  "rationale_summary": "Source-to-sink flow was confirmed; this mock planner emits only an abstract candidate shape for later symbolic verification.",
  "safety": {
    "contains_concrete_payload": false,
    "contains_executable_code": false,
    "requires_human_review": true
  },
  "target_name": "toy_02_filter_chars"
}
